[
  {
    "merchant_id": "mch_t9a33x7v_542452",
    "merchant_name": "Synthetic Merchant 001",
    "category": "remittance",
    "country": "GB",
    "risk_tier": "low",
    "is_high_risk": false
  },
  {
    "merchant_id": "mch_iizeibrd_602162",
    "merchant_name": "Synthetic Merchant 002",
    "category": "bill_payments",
    "country": "GB",
    "risk_tier": "low",
    "is_high_risk": false
  },
  {
    "merchant_id": "mch_bhmj5sga_607982",
    "merchant_name": "Synthetic Merchant 003",
    "category": "remittance",
    "country": "GB",
    "risk_tier": "medium",
    "is_high_risk": false
  },
  {
    "merchant_id": "mch_tgvqpmo7_598387",
    "merchant_name": "Synthetic Merchant 004",
    "category": "bill_payments",
    "country": "GB",
    "risk_tier": "low",
    "is_high_risk": false
  },
  {
    "merchant_id": "mch_1xu0wp9x_220292",
    "merchant_name": "Synthetic Merchant 005",
    "category": "bill_payments",
    "country": "GB",
    "risk_tier": "critical",
    "is_high_risk": true
  },
  {
    "merchant_id": "mch_x0wcjy8r_890453",
    "merchant_name": "Synthetic Merchant 006",
    "category": "bill_payments",
    "country": "GB",
    "risk_tier": "low",
    "is_high_risk": false
  },
  {
    "merchant_id": "mch_dw85kb2y_416331",
    "merchant_name": "Synthetic Merchant 007",
    "category": "remittance",
    "country": "GB",
    "risk_tier": "low",
    "is_high_risk": false
  },
  {
    "merchant_id": "mch_zvn5d2rb_168393",
    "merchant_name": "Synthetic Merchant 008",
    "category": "remittance",
    "country": "KE",
    "risk_tier": "medium",
    "is_high_risk": false
  },
  {
    "merchant_id": "mch_991ehio0_540394",
    "merchant_name": "Synthetic Merchant 009",
    "category": "remittance",
    "country": "GB",
    "risk_tier": "low",
    "is_high_risk": false
  },
  {
    "merchant_id": "mch_92ltxt3c_839715",
    "merchant_name": "Synthetic Merchant 010",
    "category": "remittance",
    "country": "GB",
    "risk_tier": "low",
    "is_high_risk": false
  },
  {
    "merchant_id": "mch_dl31uf8i_692632",
    "merchant_name": "Synthetic Merchant 011",
    "category": "remittance",
    "country": "IN",
    "risk_tier": "low",
    "is_high_risk": false
  },
  {
    "merchant_id": "mch_nnawmj6o_508153",
    "merchant_name": "Synthetic Merchant 012",
    "category": "remittance",
    "country": "GB",
    "risk_tier": "low",
    "is_high_risk": false
  },
  {
    "merchant_id": "mch_gk03gwhf_937755",
    "merchant_name": "Synthetic Merchant 013",
    "category": "remittance",
    "country": "GB",
    "risk_tier": "low",
    "is_high_risk": false
  },
  {
    "merchant_id": "mch_51wa3dym_799224",
    "merchant_name": "Synthetic Merchant 014",
    "category": "remittance",
    "country": "GB",
    "risk_tier": "medium",
    "is_high_risk": false
  },
  {
    "merchant_id": "mch_k9egzgu8_516467",
    "merchant_name": "Synthetic Merchant 015",
    "category": "bill_payments",
    "country": "GB",
    "risk_tier": "medium",
    "is_high_risk": false
  },
  {
    "merchant_id": "mch_5sy1x1fq_640139",
    "merchant_name": "Synthetic Merchant 016",
    "category": "bill_payments",
    "country": "GB",
    "risk_tier": "medium",
    "is_high_risk": false
  },
  {
    "merchant_id": "mch_iy9eyaqu_647503",
    "merchant_name": "Synthetic Merchant 017",
    "category": "remittance",
    "country": "GB",
    "risk_tier": "low",
    "is_high_risk": false
  },
  {
    "merchant_id": "mch_pxd4kc5j_172862",
    "merchant_name": "Synthetic Merchant 018",
    "category": "remittance",
    "country": "GB",
    "risk_tier": "medium",
    "is_high_risk": false
  },
  {
    "merchant_id": "mch_82tw9gj5_262309",
    "merchant_name": "Synthetic Merchant 019",
    "category": "bill_payments",
    "country": "GB",
    "risk_tier": "medium",
    "is_high_risk": false
  },
  {
    "merchant_id": "mch_8di9jdpg_314083",
    "merchant_name": "Synthetic Merchant 020",
    "category": "remittance",
    "country": "GB",
    "risk_tier": "low",
    "is_high_risk": false
  },
  {
    "merchant_id": "mch_crfwkm9y_156272",
    "merchant_name": "Synthetic Merchant 021",
    "category": "remittance",
    "country": "US",
    "risk_tier": "medium",
    "is_high_risk": false
  },
  {
    "merchant_id": "mch_lxpd2470_269051",
    "merchant_name": "Synthetic Merchant 022",
    "category": "remittance",
    "country": "GB",
    "risk_tier": "low",
    "is_high_risk": false
  },
  {
    "merchant_id": "mch_7t0oty9z_116985",
    "merchant_name": "Synthetic Merchant 023",
    "category": "remittance",
    "country": "GB",
    "risk_tier": "low",
    "is_high_risk": false
  },
  {
    "merchant_id": "mch_aool0bo7_874636",
    "merchant_name": "Synthetic Merchant 024",
    "category": "bill_payments",
    "country": "GB",
    "risk_tier": "critical",
    "is_high_risk": true
  },
  {
    "merchant_id": "mch_g4i0eox4_351947",
    "merchant_name": "Synthetic Merchant 025",
    "category": "remittance",
    "country": "GB",
    "risk_tier": "critical",
    "is_high_risk": true
  },
  {
    "merchant_id": "mch_num02ol2_603120",
    "merchant_name": "Synthetic Merchant 026",
    "category": "bill_payments",
    "country": "GB",
    "risk_tier": "low",
    "is_high_risk": false
  },
  {
    "merchant_id": "mch_ovoal41z_279409",
    "merchant_name": "Synthetic Merchant 027",
    "category": "remittance",
    "country": "GB",
    "risk_tier": "low",
    "is_high_risk": false
  },
  {
    "merchant_id": "mch_23jy7w5j_522283",
    "merchant_name": "Synthetic Merchant 028",
    "category": "bill_payments",
    "country": "GB",
    "risk_tier": "low",
    "is_high_risk": false
  },
  {
    "merchant_id": "mch_kpx270uv_661497",
    "merchant_name": "Synthetic Merchant 029",
    "category": "bill_payments",
    "country": "GB",
    "risk_tier": "medium",
    "is_high_risk": false
  },
  {
    "merchant_id": "mch_5adu8hss_424531",
    "merchant_name": "Synthetic Merchant 030",
    "category": "remittance",
    "country": "GB",
    "risk_tier": "medium",
    "is_high_risk": false
  },
  {
    "merchant_id": "mch_5dry8ta6_758195",
    "merchant_name": "Synthetic Merchant 031",
    "category": "remittance",
    "country": "GH",
    "risk_tier": "low",
    "is_high_risk": false
  },
  {
    "merchant_id": "mch_312f9l9b_648304",
    "merchant_name": "Synthetic Merchant 032",
    "category": "remittance",
    "country": "GB",
    "risk_tier": "critical",
    "is_high_risk": true
  },
  {
    "merchant_id": "mch_hian14ve_352971",
    "merchant_name": "Synthetic Merchant 033",
    "category": "remittance",
    "country": "GB",
    "risk_tier": "low",
    "is_high_risk": false
  },
  {
    "merchant_id": "mch_epvyx3e3_655358",
    "merchant_name": "Synthetic Merchant 034",
    "category": "bill_payments",
    "country": "GB",
    "risk_tier": "low",
    "is_high_risk": false
  },
  {
    "merchant_id": "mch_31y6y0lo_259390",
    "merchant_name": "Synthetic Merchant 035",
    "category": "bill_payments",
    "country": "GB",
    "risk_tier": "medium",
    "is_high_risk": false
  },
  {
    "merchant_id": "mch_tord0cr8_146601",
    "merchant_name": "Synthetic Merchant 036",
    "category": "remittance",
    "country": "GB",
    "risk_tier": "low",
    "is_high_risk": false
  },
  {
    "merchant_id": "mch_5rcg6mle_857219",
    "merchant_name": "Synthetic Merchant 037",
    "category": "bill_payments",
    "country": "NG",
    "risk_tier": "medium",
    "is_high_risk": false
  },
  {
    "merchant_id": "mch_i5iz95o5_894409",
    "merchant_name": "Synthetic Merchant 038",
    "category": "remittance",
    "country": "GB",
    "risk_tier": "medium",
    "is_high_risk": false
  },
  {
    "merchant_id": "mch_mrgt3k0j_569203",
    "merchant_name": "Synthetic Merchant 039",
    "category": "bill_payments",
    "country": "GB",
    "risk_tier": "critical",
    "is_high_risk": true
  },
  {
    "merchant_id": "mch_tiijgfo8_189768",
    "merchant_name": "Synthetic Merchant 040",
    "category": "remittance",
    "country": "GB",
    "risk_tier": "medium",
    "is_high_risk": false
  },
  {
    "merchant_id": "mch_7h2t9og5_737003",
    "merchant_name": "Synthetic Merchant 041",
    "category": "remittance",
    "country": "US",
    "risk_tier": "medium",
    "is_high_risk": false
  },
  {
    "merchant_id": "mch_g7dfxunc_946168",
    "merchant_name": "Synthetic Merchant 042",
    "category": "bill_payments",
    "country": "GB",
    "risk_tier": "medium",
    "is_high_risk": false
  },
  {
    "merchant_id": "mch_vkyf3ksb_161815",
    "merchant_name": "Synthetic Merchant 043",
    "category": "remittance",
    "country": "GB",
    "risk_tier": "low",
    "is_high_risk": false
  },
  {
    "merchant_id": "mch_9h4i1iq4_487733",
    "merchant_name": "Synthetic Merchant 044",
    "category": "remittance",
    "country": "GB",
    "risk_tier": "medium",
    "is_high_risk": false
  },
  {
    "merchant_id": "mch_kowsuji4_115557",
    "merchant_name": "Synthetic Merchant 045",
    "category": "bill_payments",
    "country": "GB",
    "risk_tier": "low",
    "is_high_risk": false
  },
  {
    "merchant_id": "mch_2uup8hze_239489",
    "merchant_name": "Synthetic Merchant 046",
    "category": "bill_payments",
    "country": "GB",
    "risk_tier": "low",
    "is_high_risk": false
  },
  {
    "merchant_id": "mch_7n6fvp2g_351430",
    "merchant_name": "Synthetic Merchant 047",
    "category": "remittance",
    "country": "GB",
    "risk_tier": "low",
    "is_high_risk": false
  },
  {
    "merchant_id": "mch_ji4nzn6c_898442",
    "merchant_name": "Synthetic Merchant 048",
    "category": "remittance",
    "country": "GB",
    "risk_tier": "low",
    "is_high_risk": false
  },
  {
    "merchant_id": "mch_tkt6pn8i_390885",
    "merchant_name": "Synthetic Merchant 049",
    "category": "remittance",
    "country": "GB",
    "risk_tier": "low",
    "is_high_risk": false
  },
  {
    "merchant_id": "mch_1sbmva1s_667974",
    "merchant_name": "Synthetic Merchant 050",